Behavior Summary Report
======================

System Call Activity:
0

Network Activity (Preview):
12:40:21.820189 eth0  B   ARP, Request who-has 192.168.88.2 tell 192.168.88.1, length 46
12:40:22.602712 eth0  Out IP 192.168.88.129.60376 > 192.168.88.2.domain: 47930+ A? example.com. (29)
12:40:22.602883 eth0  Out IP 192.168.88.129.60376 > 192.168.88.2.domain: 40503+ AAAA? example.com. (29)
12:40:22.632498 eth0  B   ARP, Request who-has 192.168.88.129 tell 192.168.88.2, length 46
12:40:22.632519 eth0  Out ARP, Reply 192.168.88.129 is-at 00:0c:29:a9:fa:83 (oui Unknown), length 28
